{
  "schema_version": 2,
  "name": "Suzuka",
  "kind": "real_imported",
  "provenance": "OpenStreetMap contributors (ODbL 1.0); imported without forced length scaling",
  "closed": true,
  "interpolation": "periodic_uniform_catmull_rom",
  "coordinate_system": {
    "type": "local_enu_wgs84",
    "origin_lat_deg": 34.844427875,
    "origin_lon_deg": 136.533185544,
    "origin_elevation_m": 0.0,
    "x_axis": "east",
    "y_axis": "north",
    "z_axis": "up",
    "units": "metres"
  },
  "control_points": [
    {
      "x_m": 378.324945,
      "y_m": 169.512312,
      "elevation_m": 0.0,
      "left_width_m": 6.0,
      "right_width_m": 6.0
    },
    {
      "x_m": 387.066994,
      "y_m": 164.664736,
      "elevation_m": 0.0,
      "left_width_m": 6.0,
      "right_width_m": 6.0
    },
    {
      "x_m": 395.809044,
      "y_m": 159.81716,
      "elevation_m": 0.0,
      "left_width_m": 6.0,
      "right_width_m": 6.0
    },
    {
      "x_m": 404.452758,
      "y_m": 154.813545,
      "elevation_m": 0.0,
      "left_width_m": 6.0,
      "right_width_m": 6.0
    },
    {
      "x_m": 412.597898,
      "y_m": 149.018797,
      "elevation_m": 0.0,
      "left_width_m": 6.0,
      "right_width_m": 6.0
    },
    {
      "x_m": 420.743038,
      "y_m": 143.224048,
      "elevation_m": 0.0,
      "left_width_m": 6.0,
      "right_width_m": 6.0
    },
    {
      "x_m": 428.508765,
      "y_m": 136.945754,
      "elevation_m": 0.0,
      "left_width_m": 6.0,
      "right_width_m": 6.0
    },
    {
      "x_m": 436.074694,
      "y_m": 130.412826,
      "elevation_m": 0.0,
      "left_width_m": 6.0,
      "right_width_m": 6.0
    },
    {
      "x_m": 443.424896,
      "y_m": 123.641708,
      "elevation_m": 0.0,
      "left_width_m": 6.0,
      "right_width_m": 6.0
    },
    {
      "x_m": 450.672893,
      "y_m": 116.757745,
      "elevation_m": 0.0,
      "left_width_m": 6.0,
      "right_width_m": 6.0
    },
    {
      "x_m": 457.611305,
      "y_m": 109.574046,
      "elevation_m": 0.0,
      "left_width_m": 6.0,
      "right_width_m": 6.0
    },
    {
      "x_m": 464.257404,
      "y_m": 102.107333,
      "elevation_m": 0.0,
      "left_width_m": 6.0,
      "right_width_m": 6.0
    },
    {
      "x_m": 470.903503,
      "y_m": 94.640621,
      "elevation_m": 0.0,
      "left_width_m": 6.0,
      "right_width_m": 6.0
    },
    {
      "x_m": 477.468896,
      "y_m": 87.103703,
      "elevation_m": 0.0,
      "left_width_m": 6.0,
      "right_width_m": 6.0
    },
    {
      "x_m": 483.943338,
      "y_m": 79.487665,
      "elevation_m": 0.0,
      "left_width_m": 6.0,
      "right_width_m": 6.0
    },
    {
      "x_m": 490.41778,
      "y_m": 71.871628,
      "elevation_m": 0.0,
      "left_width_m": 6.0,
      "right_width_m": 6.0
    },
    {
      "x_m": 496.892222,
      "y_m": 64.255591,
      "elevation_m": 0.0,
      "left_width_m": 6.0,
      "right_width_m": 6.0
    },
    {
      "x_m": 503.351643,
      "y_m": 56.626949,
      "elevation_m": 0.0,
      "left_width_m": 6.0,
      "right_width_m": 6.0
    },
    {
      "x_m": 509.727834,
      "y_m": 48.928468,
      "elevation_m": 0.0,
      "left_width_m": 6.0,
      "right_width_m": 6.0
    },
    {
      "x_m": 516.104026,
      "y_m": 41.229987,
      "elevation_m": 0.0,
      "left_width_m": 6.0,
      "right_width_m": 6.0
    },
    {
      "x_m": 522.480217,
      "y_m": 33.531507,
      "elevation_m": 0.0,
      "left_width_m": 6.0,
      "right_width_m": 6.0
    },
    {
      "x_m": 528.856409,
      "y_m": 25.833026,
      "elevation_m": 0.0,
      "left_width_m": 6.0,
      "right_width_m": 6.0
    },
    {
      "x_m": 535.232601,
      "y_m": 18.134545,
      "elevation_m": 0.0,
      "left_width_m": 6.0,
      "right_width_m": 6.0
    },
    {
      "x_m": 541.608792,
      "y_m": 10.436065,
      "elevation_m": 0.0,
      "left_width_m": 6.0,
      "right_width_m": 6.0
    },
    {
      "x_m": 547.984984,
      "y_m": 2.737584,
      "elevation_m": 0.0,
      "left_width_m": 6.0,
      "right_width_m": 6.0
    },
    {
      "x_m": 554.361175,
      "y_m": -4.960897,
      "elevation_m": 0.0,
      "left_width_m": 6.0,
      "right_width_m": 6.0
    },
    {
      "x_m": 560.737367,
      "y_m": -12.659377,
      "elevation_m": 0.0,
      "left_width_m": 6.0,
      "right_width_m": 6.0
    },
    {
      "x_m": 567.113558,
      "y_m": -20.357858,
      "elevation_m": 0.0,
      "left_width_m": 6.0,
      "right_width_m": 6.0
    },
    {
      "x_m": 573.48975,
      "y_m": -28.056339,
      "elevation_m": 0.0,
      "left_width_m": 6.0,
      "right_width_m": 6.0
    },
    {
      "x_m": 579.865941,
      "y_m": -35.75482,
      "elevation_m": 0.0,
      "left_width_m": 6.0,
      "right_width_m": 6.0
    },
    {
      "x_m": 586.242133,
      "y_m": -43.4533,
      "elevation_m": 0.0,
      "left_width_m": 6.0,
      "right_width_m": 6.0
    },
    {
      "x_m": 592.618324,
      "y_m": -51.151781,
      "elevation_m": 0.0,
      "left_width_m": 6.0,
      "right_width_m": 6.0
    },
    {
      "x_m": 598.994516,
      "y_m": -58.850262,
      "elevation_m": 0.0,
      "left_width_m": 6.0,
      "right_width_m": 6.0
    },
    {
      "x_m": 605.370707,
      "y_m": -66.548742,
      "elevation_m": 0.0,
      "left_width_m": 6.0,
      "right_width_m": 6.0
    },
    {
      "x_m": 611.746899,
      "y_m": -74.247223,
      "elevation_m": 0.0,
      "left_width_m": 6.0,
      "right_width_m": 6.0
    },
    {
      "x_m": 618.12309,
      "y_m": -81.945704,
      "elevation_m": 0.0,
      "left_width_m": 6.0,
      "right_width_m": 6.0
    },
    {
      "x_m": 624.499282,
      "y_m": -89.644184,
      "elevation_m": 0.0,
      "left_width_m": 6.0,
      "right_width_m": 6.0
    },
    {
      "x_m": 630.875473,
      "y_m": -97.342665,
      "elevation_m": 0.0,
      "left_width_m": 6.0,
      "right_width_m": 6.0
    },
    {
      "x_m": 637.251665,
      "y_m": -105.041146,
      "elevation_m": 0.0,
      "left_width_m": 6.0,
      "right_width_m": 6.0
    },
    {
      "x_m": 643.627856,
      "y_m": -112.739626,
      "elevation_m": 0.0,
      "left_width_m": 6.0,
      "right_width_m": 6.0
    },
    {
      "x_m": 650.004048,
      "y_m": -120.438107,
      "elevation_m": 0.0,
      "left_width_m": 6.0,
      "right_width_m": 6.0
    },
    {
      "x_m": 656.38024,
      "y_m": -128.136588,
      "elevation_m": 0.0,
      "left_width_m": 6.0,
      "right_width_m": 6.0
    },
    {
      "x_m": 662.756431,
      "y_m": -135.835068,
      "elevation_m": 0.0,
      "left_width_m": 6.0,
      "right_width_m": 6.0
    },
    {
      "x_m": 669.132623,
      "y_m": -143.533549,
      "elevation_m": 0.0,
      "left_width_m": 6.0,
      "right_width_m": 6.0
    },
    {
      "x_m": 675.508814,
      "y_m": -151.23203,
      "elevation_m": 0.0,
      "left_width_m": 6.0,
      "right_width_m": 6.0
    },
    {
      "x_m": 681.885006,
      "y_m": -158.93051,
      "elevation_m": 0.0,
      "left_width_m": 6.0,
      "right_width_m": 6.0
    },
    {
      "x_m": 688.261197,
      "y_m": -166.628991,
      "elevation_m": 0.0,
      "left_width_m": 6.0,
      "right_width_m": 6.0
    },
    {
      "x_m": 694.637389,
      "y_m": -174.327472,
      "elevation_m": 0.0,
      "left_width_m": 6.0,
      "right_width_m": 6.0
    },
    {
      "x_m": 701.01358,
      "y_m": -182.025953,
      "elevation_m": 0.0,
      "left_width_m": 6.0,
      "right_width_m": 6.0
    },
    {
      "x_m": 707.389772,
      "y_m": -189.724433,
      "elevation_m": 0.0,
      "left_width_m": 6.0,
      "right_width_m": 6.0
    },
    {
      "x_m": 713.765963,
      "y_m": -197.422914,
      "elevation_m": 0.0,
      "left_width_m": 6.0,
      "right_width_m": 6.0
    },
    {
      "x_m": 720.142155,
      "y_m": -205.121395,
      "elevation_m": 0.0,
      "left_width_m": 6.0,
      "right_width_m": 6.0
    },
    {
      "x_m": 726.505133,
      "y_m": -212.830768,
      "elevation_m": 0.0,
      "left_width_m": 6.0,
      "right_width_m": 6.0
    },
    {
      "x_m": 732.845583,
      "y_m": -220.558711,
      "elevation_m": 0.0,
      "left_width_m": 6.0,
      "right_width_m": 6.0
    },
    {
      "x_m": 739.186034,
      "y_m": -228.286655,
      "elevation_m": 0.0,
      "left_width_m": 6.0,
      "right_width_m": 6.0
    },
    {
      "x_m": 745.526484,
      "y_m": -236.014598,
      "elevation_m": 0.0,
      "left_width_m": 6.0,
      "right_width_m": 6.0
    },
    {
      "x_m": 751.866935,
      "y_m": -243.742542,
      "elevation_m": 0.0,
      "left_width_m": 6.0,
      "right_width_m": 6.0
    },
    {
      "x_m": 758.207385,
      "y_m": -251.470485,
      "elevation_m": 0.0,
      "left_width_m": 6.0,
      "right_width_m": 6.0
    },
    {
      "x_m": 764.547836,
      "y_m": -259.198429,
      "elevation_m": 0.0,
      "left_width_m": 6.0,
      "right_width_m": 6.0
    },
    {
      "x_m": 770.888286,
      "y_m": -266.926372,
      "elevation_m": 0.0,
      "left_width_m": 6.0,
      "right_width_m": 6.0
    },
    {
      "x_m": 777.228737,
      "y_m": -274.654316,
      "elevation_m": 0.0,
      "left_width_m": 6.0,
      "right_width_m": 6.0
    },
    {
      "x_m": 783.569187,
      "y_m": -282.382259,
      "elevation_m": 0.0,
      "left_width_m": 6.0,
      "right_width_m": 6.0
    },
    {
      "x_m": 789.909638,
      "y_m": -290.110203,
      "elevation_m": 0.0,
      "left_width_m": 6.0,
      "right_width_m": 6.0
    },
    {
      "x_m": 796.250088,
      "y_m": -297.838146,
      "elevation_m": 0.0,
      "left_width_m": 6.0,
      "right_width_m": 6.0
    },
    {
      "x_m": 802.590539,
      "y_m": -305.56609,
      "elevation_m": 0.0,
      "left_width_m": 6.0,
      "right_width_m": 6.0
    },
    {
      "x_m": 808.930989,
      "y_m": -313.294033,
      "elevation_m": 0.0,
      "left_width_m": 6.0,
      "right_width_m": 6.0
    },
    {
      "x_m": 815.27144,